platform,post_id,posted_at,date,clean_item_label,price,purchase_amount,tips_amount,total_post_amount,estimated_creator_net,views,likes,comments,media_count,media_types,rank_purchases,rank_tips,rank_views,rank_likes,rank_comments,included_tabs,period_start,period_end,source_file,imported_at,row_hash
OnlyFans,2249600874,2026-02-01T01:12:04+00:00,2026-02-01,"Your wife comes home and doesn't even glance at you before tearing into her family size bucket of chicken! Unlock if you love stroking to the sultry sounds of chewing, burping, and farts! 🍗",15.99,335.79,0.0,335.79,268.63,10244,3,,2,"photo, video",1,12,1,8,12,"comments,likes,purchases,tips,views",2026-01-01,2026-07-01,2026-07-01_11-34-31_onlyfans_native_posts_2026-01-01_to_2026-07-01.json,2026-07-01T11:36:54,18f44fbeffc24f0f7a1a2c7dcde91fde330ff4c6696b8759da7047d36d44eddd
OnlyFans,2390544755,2026-04-07T20:49:38+00:00,2026-04-07,"You've been spotted by a massive gassy giantess, and there's nowhere for you to run. Will her burps and farts knock you out before she swallows you whole? You'll have to unlock to find out! 💨😘",24.99,199.92,0.0,199.92,159.94,7839,2,,3,"photo, video",2,8,6,9,10,"comments,likes,purchases,tips,views",2026-01-01,2026-07-01,2026-07-01_11-34-31_onlyfans_native_posts_2026-01-01_to_2026-07-01.json,2026-07-01T11:36:54,1d5144c5801157162ebc8e323b8895fc9a29a5178b915af5b6389cee36a5d7dd
OnlyFans,2488870647,2026-05-22T23:37:56+00:00,2026-05-22,"I thought these diet pills would solve everything, but it all went wrong! 😳 I grew so quick and got wedged in the car, by then it was too late... Unlock if you wanna see me expand until I pop! 🍗🎈",14.99,149.9,0.0,149.9,119.92,6223,1,,3,"photo, video",3,5,11,10,8,"comments,likes,purchases,tips,views",2026-01-01,2026-07-01,2026-07-01_11-34-31_onlyfans_native_posts_2026-01-01_to_2026-07-01.json,2026-07-01T11:36:54,714c338a05c8e0276b8c0a29bd714e071c6b5aa294e31902dcae1f408fec693c
OnlyFans,2296461362,2026-02-23T04:00:32+00:00,2026-02-23,"Six years after her last visit, Dorothy is back in Oz and fatter than ever! 😍The Wizard won't be able to resist her luscious new body. If you love weight gain, sparkly red heels, and POV fucking, you definitely don't want to miss this one!",23.99,143.94,0.0,143.94,115.15,9410,,,2,"photo, video",4,11,3,12,11,"comments,likes,purchases,tips,views",2026-01-01,2026-07-01,2026-07-01_11-34-31_onlyfans_native_posts_2026-01-01_to_2026-07-01.json,2026-07-01T11:36:54,45e65b1d486f9e6d5f5260765bfe34772d854305831a25f5340b1f1d343a622d
OnlyFans,2433784905,2026-04-28T01:39:40+00:00,2026-04-28,"You've been spotted by a massive gassy giantess, and there's nowhere for you to run. Will her burps and farts knock you out before she swallows you whole? You'll have to unlock to find out! 💨😘",24.99,74.97,0.0,74.97,59.98,7615,,,3,"photo, video",5,7,7,11,9,"comments,likes,purchases,tips,views",2026-01-01,2026-07-01,2026-07-01_11-34-31_onlyfans_native_posts_2026-01-01_to_2026-07-01.json,2026-07-01T11:36:54,7990c0a240b0cc38d6c4cf0192ca48c3d42dc6bf7e0b0ea12fad525b60fb5a8b
OnlyFans,2249508351,2026-01-31T23:14:51+00:00,2026-01-31,"Can't get over how massive I look in this video! Check your messages, this is an unlock you don't want to miss! 😍",,,20.0,20.0,16.0,8688,248,3,3,photo,12,1,5,6,6,"comments,likes,purchases,tips,views",2026-01-01,2026-07-01,2026-07-01_11-34-31_onlyfans_native_posts_2026-01-01_to_2026-07-01.json,2026-07-01T11:36:54,23ab8af51ea3dc42ea87fce5e7fcb580a8478c82d925ce6d7ab38399a9157e28
OnlyFans,2420500061,2026-04-22T20:40:05+00:00,2026-04-22,How I feel after stuffing my face 🥵🍕,,,5.0,5.0,4.0,7028,250,1,2,photo,9,2,10,4,7,"comments,likes,purchases,tips,views",2026-01-01,2026-07-01,2026-07-01_11-34-31_onlyfans_native_posts_2026-01-01_to_2026-07-01.json,2026-07-01T11:36:54,aae8af364b9e2897f7457bd4077efd5beb9b14cde8fabcfdf7c976fbfc1bac61
OnlyFans,2332701512,2026-03-11T23:09:58+00:00,2026-03-11,Before and after 🌯🤤,,,0.0,,,9724,269,9,3,photo,10,9,2,2,2,"comments,likes,purchases,tips,views",2026-01-01,2026-07-01,2026-07-01_11-34-31_onlyfans_native_posts_2026-01-01_to_2026-07-01.json,2026-07-01T11:36:54,7bdcfdc6c5a8a66e2c25f485b6fcb7cdc91108bc86d9702f47c5447dd05b993b
OnlyFans,2320087914,2026-03-06T05:16:14+00:00,2026-03-06,"I’m so turned on thinking about all of you getting manipulated into becoming my feeders! 🤭 If you missed it, check your messages and get in on the fun! 😘💜",,,0.0,,,9071,250,3,3,photo,11,10,4,5,5,"comments,likes,purchases,tips,views",2026-01-01,2026-07-01,2026-07-01_11-34-31_onlyfans_native_posts_2026-01-01_to_2026-07-01.json,2026-07-01T11:36:54,eaba328fca810ee05a67f0d3c2e843641983a61f73dc8e4f5ef111904db443ee
OnlyFans,2488879325,2026-05-23T21:04:44+00:00,2026-05-23,"Boobs, belly, and booty. What more could you want? 😍",,,0.0,,,7505,266,7,3,photo,7,4,8,3,3,"comments,likes,purchases,tips,views",2026-01-01,2026-07-01,2026-07-01_11-34-31_onlyfans_native_posts_2026-01-01_to_2026-07-01.json,2026-07-01T11:36:54,dfe0f0d95093c9d12c89a87695db496737cf690e61eb3d6c4dbe889c965b2c9d
OnlyFans,2450977574,2026-05-06T20:52:02+00:00,2026-05-06,How much fatter do you wanna see me get? 😈,,,0.0,,,7298,284,10,2,photo,8,6,9,1,1,"comments,likes,purchases,tips,views",2026-01-01,2026-07-01,2026-07-01_11-34-31_onlyfans_native_posts_2026-01-01_to_2026-07-01.json,2026-07-01T11:36:54,635a3667537b6d895d87fe4a341f1ba8557e6abbaef57b1f70a6029dcf106142
OnlyFans,2570265452,2026-06-29T02:43:40+00:00,2026-06-29,What if we hung out and I ate all your leftovers? 🤤🥡,,,0.0,,,3689,203,3,3,photo,6,3,12,7,4,"comments,likes,purchases,tips,views",2026-01-01,2026-07-01,2026-07-01_11-34-31_onlyfans_native_posts_2026-01-01_to_2026-07-01.json,2026-07-01T11:36:54,4ff8c1249c32beeee4f90cb2e1f5d369778c8e2995469801724c843c57fbf854
